{
  "schemaVersion": "1.0.0",
  "tenantId": "11111111-1111-4111-8111-111111111111",
  "subscriptionId": "77777777-7777-4777-8777-777777777777",
  "resourceGroup": "rg-agent-sentinel",
  "profileName": "fd-as-m098047",
  "endpointName": "agent-sentinel",
  "frontDoorOrigin": "https://sentinel-replacement.example.com",
  "stage": "read-only"
}
